weight	latitude	longitude	rank	hs_name
1.4863409886393792	37.7709383	-122.4460845	136	Urban School, CA, United States of America
1.0701792203743343	44.86770600000001	-93.137374	368	St Thomas Academy, MN, United States of America
0.79320966546474	33.5613897	-117.7191495	912	Aliso Niguel, CA, United States of America
0.7753915933850833	45.2073218	-67.2738095	977	St Stephen's, ON, Cananda
0.7418716019576906	45.6238928	-122.4677841	1117	Union, WA, United States of America
0.7265337556288775	42.3065061	-71.8242418	1190	St Peters Marian, MA, United States of America
